{
  "$schema": "http://json-schema.org/draft-07/schema#",
  "$id": "https://salahapi.com/schemas/1.0.schema.json",
  "title": "SalahAPI 1.0",
  "description": "JSON Schema for SalahAPI 1.0 Specification - A standard format for Islamic prayer times data",
  "type": "object",
  "required": ["salahapi", "info"],
  "properties": {
    "salahapi": {
      "type": "string",
      "description": "The version of the SalahAPI Specification being used",
      "pattern": "^1\\.0(\\.\\d+)?$",
      "examples": ["1.0", "1.0.0"]
    },
    "info": {
      "$ref": "#/definitions/InfoObject"
    },
    "location": {
      "$ref": "#/definitions/LocationObject"
    },
    "calculationMethod": {
      "$ref": "#/definitions/CalculationMethodObject"
    },
    "dailyPrayerTimes": {
      "$ref": "#/definitions/DailyPrayerTimesObject"
    }
  },
  "definitions": {
    "InfoObject": {
      "type": "object",
      "description": "Provides metadata about the prayer times data",
      "required": ["title", "description", "version"],
      "properties": {
        "title": {
          "type": "string",
          "description": "The title of the organization or service providing the prayer times"
        },
        "description": {
          "type": "string",
          "description": "A description of the organization or service"
        },
        "version": {
          "type": "string",
          "description": "The version of the prayer times data document"
        },
        "contact": {
          "$ref": "#/definitions/ContactObject"
        }
      }
    },
    "ContactObject": {
      "type": "object",
      "description": "Contact information for the service maintainer",
      "properties": {
        "name": {
          "type": "string",
          "description": "Contact name"
        },
        "email": {
          "type": "string",
          "format": "email",
          "description": "Contact email address"
        },
        "url": {
          "type": "string",
          "format": "uri",
          "description": "Contact URL"
        }
      }
    },
    "LocationObject": {
      "type": "object",
      "description": "Defines the geographic location for which prayer times are calculated",
      "required": ["latitude", "longitude", "timezone", "dateFormat", "timeFormat"],
      "properties": {
        "latitude": {
          "type": "number",
          "description": "Decimal degrees latitude",
          "minimum": -90,
          "maximum": 90
        },
        "longitude": {
          "type": "number",
          "description": "Decimal degrees longitude",
          "minimum": -180,
          "maximum": 180
        },
        "timezone": {
          "type": "string",
          "description": "IANA timezone identifier",
          "examples": ["America/New_York", "Europe/London", "Asia/Dubai"]
        },
        "city": {
          "type": "string",
          "description": "City name"
        },
        "country": {
          "type": "string",
          "description": "Country name"
        },
        "dateFormat": {
          "type": "string",
          "description": "Date format used in the document",
          "examples": ["YYYY-MM-DD", "DD/MM/YYYY", "MM/DD/YYYY"]
        },
        "timeFormat": {
          "type": "string",
          "description": "Time format used in the document",
          "examples": ["HH:mm", "HH:mm:ss", "hh:mm A"]
        }
      }
    },
    "CalculationMethodObject": {
      "type": "object",
      "description": "Defines the parameters used for calculating prayer times",
      "required": ["name"],
      "properties": {
        "name": {
          "type": "string",
          "description": "Calculation method identifier",
          "enum": [
            "isna",
            "mwl",
            "egypt",
            "makkah",
            "karachi",
            "tehran",
            "jafari",
            "dubai",
            "kuwait",
            "qatar",
            "singapore",
            "france",
            "turkey",
            "russia",
            "other"
          ]
        },
        "fajrAngle": {
          "type": "number",
          "description": "Angle of sun below horizon for Fajr (degrees)",
          "minimum": 0,
          "maximum": 90
        },
        "ishaAngle": {
          "type": "number",
          "description": "Angle of sun below horizon for Isha (degrees)",
          "minimum": 0,
          "maximum": 90
        },
        "asrCalculationMethod": {
          "type": "string",
          "description": "Method for calculating Asr",
          "enum": ["standard", "hanafi"]
        },
        "highLatitudeAdjustment": {
          "type": "string",
          "description": "Adjustment method for high latitude locations",
          "enum": ["middleOfTheNight", "oneSeventh", "twilightAngle"]
        },
        "iqamaCalculationRules": {
          "$ref": "#/definitions/IqamaCalculationRulesObject"
        },
        "jumuahRules": {
          "type": "array",
          "description": "Array of Jumuah (Friday prayer) rules",
          "items": {
            "$ref": "#/definitions/JumuahRuleObject"
          }
        }
      }
    },
    "DailyPrayerTimesObject": {
      "type": "object",
      "description": "Provides a reference to the static CSV data containing daily prayer times",
      "required": ["csvUrl", "dateFormat", "timeFormat"],
      "properties": {
        "csvUrl": {
          "type": "string",
          "format": "uri",
          "description": "URL to the endpoint containing prayer times in CSV format"
        },
        "csvUrlParameters": {
          "type": "object",
          "description": "Optional URL parameters that can be passed to the CSV endpoint",
          "additionalProperties": {
            "oneOf": [
              {
                "type": "object",
                "description": "Date parameter with type and format",
                "required": ["in", "type", "format"],
                "properties": {
                  "in": {
                    "type": "string",
                    "enum": ["query", "path", "header"],
                    "description": "Where the parameter should be sent"
                  },
                  "type": {
                    "type": "string",
                    "enum": ["fromDate", "toDate"],
                    "description": "Type of date parameter"
                  },
                  "format": {
                    "type": "string",
                    "description": "Date format for the parameter",
                    "examples": ["YYYY-MM-DD", "DD/MM/YYYY", "MM/DD/YYYY"]
                  }
                }
              },
              {
                "type": "object",
                "description": "Static value parameter",
                "required": ["in", "value"],
                "properties": {
                  "in": {
                    "type": "string",
                    "enum": ["query", "path", "header"],
                    "description": "Where the parameter should be sent"
                  },
                  "value": {
                    "oneOf": [
                      {"type": "string"},
                      {"type": "number"}
                    ],
                    "description": "Static value to pass as parameter"
                  }
                }
              }
            ]
          }
        },
        "dateFormat": {
          "type": "string",
          "description": "Date format used in the CSV",
          "examples": ["YYYY-MM-DD", "DD/MM/YYYY", "MM/DD/YYYY"]
        },
        "timeFormat": {
          "type": "string",
          "description": "Time format used in the CSV",
          "examples": ["HH:mm", "HH:mm:ss", "hh:mm A"]
        }
      }
    },
    "IqamaCalculationRulesObject": {
      "type": "object",
      "description": "Defines the rules for calculating Iqama times",
      "properties": {
        "changeOn": {
          "type": "string",
          "description": "Day of the week when Iqama times change",
          "enum": ["sunday", "monday", "tuesday", "wednesday", "thursday", "friday", "saturday"]
        },
        "fajr": {
          "$ref": "#/definitions/PrayerCalculationRuleObject"
        },
        "dhuhr": {
          "$ref": "#/definitions/PrayerCalculationRuleObject"
        },
        "asr": {
          "$ref": "#/definitions/PrayerCalculationRuleObject"
        },
        "maghrib": {
          "$ref": "#/definitions/PrayerCalculationRuleObject"
        },
        "isha": {
          "$ref": "#/definitions/PrayerCalculationRuleObject"
        }
      }
    },
    "PrayerCalculationRuleObject": {
      "type": "object",
      "description": "Defines a single prayer time calculation rule",
      "properties": {
        "static": {
          "type": "string",
          "description": "Static time value in 24-hour format. If specified, all other fields are ignored.",
          "pattern": "^([01]\\d|2[0-3]):[0-5]\\d$",
          "examples": ["12:30", "06:45"]
        },
        "change": {
          "type": "string",
          "description": "Frequency of change",
          "enum": ["daily", "weekly"]
        },
        "roundMinutes": {
          "type": "number",
          "description": "Number of minutes to round to",
          "minimum": 1,
          "examples": [1, 5, 15, 30]
        },
        "earliest": {
          "type": "string",
          "description": "Earliest allowed time in 24-hour format",
          "pattern": "^([01]\\d|2[0-3]):[0-5]\\d$",
          "examples": ["04:00", "05:30"]
        },
        "latest": {
          "type": "string",
          "description": "Latest allowed time in 24-hour format",
          "pattern": "^([01]\\d|2[0-3]):[0-5]\\d$",
          "examples": ["23:45", "21:00"]
        },
        "afterAthanMinutes": {
          "type": "number",
          "description": "Delay in minutes after the Athan (call to prayer)",
          "minimum": 0,
          "examples": [5, 10, 15]
        },
        "beforeEndMinutes": {
          "type": "number",
          "description": "Minutes before the end of the prayer timeframe",
          "minimum": 0,
          "examples": [30, 45, 60]
        },
        "overrides": {
          "type": "array",
          "description": "Array of date-specific overrides for the prayer time calculation rule",
          "items": {
            "$ref": "#/definitions/PrayerCalculationOverrideRuleObject"
          }
        }
      }
    },
    "PrayerCalculationOverrideRuleObject": {
      "type": "object",
      "description": "Defines a date-specific override for a prayer time calculation rule",
      "required": ["condition", "time"],
      "properties": {
        "condition": {
          "type": "string",
          "description": "The type of override rule",
          "enum": ["daylightSavingsTime", "ramadan"]
        },
        "time": {
          "$ref": "#/definitions/PrayerCalculationRuleObject",
          "description": "The prayer calculation rule to apply for the override"
        }
      }
    },
    "JumuahRuleObject": {
      "type": "object",
      "description": "Defines a single Jumuah (Friday prayer) rule",
      "properties": {
        "name": {
          "type": "string",
          "description": "Name of the Jumuah prayer",
          "examples": ["Jumuah 1", "Youth Jumuah", "Sisters Jumuah"]
        },
        "time": {
          "$ref": "#/definitions/PrayerCalculationRuleObject",
          "description": "Calculation rule for Jumuah time"
        },
        "location": {
          "$ref": "#/definitions/JumuahLocationObject",
          "description": "Location information for the Jumuah prayer"
        }
      }
    },
    "JumuahLocationObject": {
      "type": "object",
      "description": "Defines the location for a Jumuah prayer",
      "properties": {
        "name": {
          "type": "string",
          "description": "Name of the location",
          "examples": ["Main Prayer Hall", "Community Center"]
        },
        "address": {
          "type": "string",
          "description": "Physical address of the location"
        }
      }
    }
  }
}
