{
  "$schema": "../versions/1.0.schema.json",
  "salahapi": "1.0",
  "info": {
    "title": "London Central Mosque Prayer Times",
    "description": "Dynamically calculated prayer times for London using Muslim World League method",
    "version": "1.0.0",
    "contact": {
      "name": "London Central Mosque",
      "email": "info@londonmosque.org",
      "url": "https://londonmosque.org"
    }
  },
  "location": {
    "latitude": 51.5074,
    "longitude": -0.1278,
    "timezone": "Europe/London",
    "city": "London",
    "country": "United Kingdom",
    "dateFormat": "DD/MM/YYYY",
    "timeFormat": "HH:mm"
  },
  "calculationMethod": {
    "name": "mwl",
    "fajrAngle": 18,
    "ishaAngle": 17,
    "asrCalculationMethod": "standard",
    "highLatitudeAdjustment": "middleOfTheNight",
    "iqamaCalculationRules": {
      "changeOn": "friday",
      "fajr": {
        "change": "daily",
        "roundMinutes": 15,
        "earliest": "04:00",
        "latest": "06:45",
        "beforeEndMinutes": 30
      },
      "dhuhr": {
        "static": "13:15"
      },
      "dhuhrDST": {
        "static": "13:30"
      },
      "asr": {
        "change": "weekly",
        "roundMinutes": 15,
        "afterAthanMinutes": 15
      },
      "asrDST": {
        "static": "16:30"
      },
      "maghrib": {
        "change": "daily",
        "roundMinutes": 1,
        "afterAthanMinutes": 5
      },
      "isha": {
        "change": "weekly",
        "roundMinutes": 15,
        "afterAthanMinutes": 10,
        "latest": "23:00"
      }
    },
    "jumuahRules": [
      {
        "name": "First Jumuah",
        "time": {
          "static": "13:00"
        },
        "timeDST": {
          "static": "13:30"
        },
        "location": {
          "name": "Main Prayer Hall",
          "address": "Park Road, London NW8 7RG, United Kingdom"
        }
      },
      {
        "name": "Second Jumuah",
        "time": {
          "static": "14:15"
        },
        "timeDST": {
          "static": "14:45"
        },
        "location": {
          "name": "Main Prayer Hall",
          "address": "Park Road, London NW8 7RG, United Kingdom"
        }
      }
    ]
  }
}
